{"artifacts":[{"path":"formal/chemgraph/ChemGraph.lean","sha256":"c92c9546b5646baa3b1df7639e25243dcd10a094332215e36a8eacca22e87267"},{"path":"formal/chemgraph/ChemGraph/Counterexamples.lean","sha256":"2d7d21b80d2c5e0d686806c19cf922fcb58da1e3bb2992eaed7761d402c76673"},{"path":"formal/chemgraph/ChemGraph/EvidenceCore.lean","sha256":"b68140599079ad286d7e5ff749ccaf72557084a27d91ff235d15094a1b78d360"},{"path":"formal/chemgraph/ChemGraph/FiniteAudit.lean","sha256":"826ca5833aa300f8d9ea53bcf7b66cce56e0dad8abae8cfd285610d099c57c84"},{"path":"formal/chemgraph/ChemGraph/Grammar.lean","sha256":"cfe0d22761155f31eec9dd98d9625bb994465e43bc3a3a9165d8994cedee665d"},{"path":"formal/chemgraph/ChemGraph/HiddenChallenge.lean","sha256":"d5a092cf4b412f3a86eb9ebabbef8098a9260f7f6eb452e5f3acca0c1e26b481"},{"path":"formal/chemgraph/ChemGraph/Identifiability.lean","sha256":"637b93e709ab494b5f3cd6dadca0ec130712855b5340b7d95678245b3e2546c4"},{"path":"formal/chemgraph/ChemGraph/Multiplicity.lean","sha256":"7ff3e86464d030a86d5d0e53d6e6000f8fc9ce15ac31d130ea13ed0ba74bc50c"},{"path":"formal/chemgraph/ChemGraph/ObservationClosure.lean","sha256":"44d77210107401490b2fa0b8ca85d4eb4f8b58a570698fc428710c93c8fdac5f"},{"path":"formal/chemgraph/ChemGraph/ObservationRecovery.lean","sha256":"db27a74a6c45a401e40ca07df38ac28782daf8efdb70c4c9577ba42689343b6e"},{"path":"formal/chemgraph/ChemGraph/RasterEvidence.lean","sha256":"4c3c1a4f422ec4a3b07804ae5524c4ef6b776c51e7bd3c88061282d9c59e9fff"},{"path":"formal/chemgraph/ChemGraph/Recovery.lean","sha256":"826f6122b6f7b8dc63777dcf76e09a992f66bc99e34e6685b722b6a98c05b856"},{"path":"formal/chemgraph/ChemGraph/Render.lean","sha256":"0117ae335d1aee1d04f8fa9ee9799ee17ade1bd1f7a0cbcd3a0f86cbd2c985ca"},{"path":"formal/chemgraph/ChemGraph/Scene.lean","sha256":"d843ca8e2f5701cbae1748db30398d1082ba8bd3d7fcce5e9e06d42aa2807189"},{"path":"formal/chemgraph/ChemGraph/Stability.lean","sha256":"8cb4b6127344114a0ce253e5812af418adaacb1b63b370ca3cc1a36e51c82ee7"},{"path":"formal/chemgraph/README.md","sha256":"146560b97550646213d717e6beab69e0deb9c8b732322a39aae1bdf844180902"},{"path":"formal/chemgraph/challenge_v0_4/generate_pack_v0_4.py","sha256":"193309ef6feb4521931b1446233c0cba7fa716a6d883e99903d053bf034a0775"},{"path":"formal/chemgraph/challenge_v0_4/rasterizer_v0_4.py","sha256":"5d673ae1c33648b5498b4ebacfc1b91136fee5abdbae4fa1503a144a59816943"},{"path":"formal/chemgraph/challenge_v0_5/README.md","sha256":"acdc02161894c8580366b14d5767f8d34447331e5c0f953e63a8f10a25b86769"},{"path":"formal/chemgraph/challenge_v0_5/__init__.py","sha256":"afd548ad90d4838628469ffbd5c3fd7ba55d47ec63951408501acc373a87267f"},{"path":"formal/chemgraph/challenge_v0_5/audit_domain_reference_v0_5.py","sha256":"d4d97da458262570028d4cbaedcff4dde8fe2e1da96c580edb15b513b55b8c69"},{"path":"formal/chemgraph/challenge_v0_5/canonical_raster_v0_5.py","sha256":"803382251f2a8e60d4704793dd2ba7813472055450048120f3a6be47669dad09"},{"path":"formal/chemgraph/challenge_v0_5/domain_scene_v0_5.py","sha256":"4d9e00fc5f1fd120079c2cfa96a47b328d05ac589984c6070afae51b728522cb"},{"path":"formal/chemgraph/challenge_v0_5/enumerate_domain_reference_v0_5.py","sha256":"1d6cb550b3ab7e649b867b55b5504afba4cf932588655d114ea3a7fcd8009c1c"},{"path":"formal/chemgraph/challenge_v0_5/enumerate_domain_v0_5.py","sha256":"0d58391b7a17739d19d7ceb11a54ed06fc32f07859c9feaf1a08a2f726135f94"},{"path":"formal/chemgraph/challenge_v0_5/prereg/p0_contract_v0_5.json","sha256":"55ddcaacdf851166554ccd586b2a924c0e793f86cc7a6319f98132ef0ffb6b65"},{"path":"formal/chemgraph/challenge_v0_5/run_raster_pilot_v0_5.py","sha256":"1afbf5bd43cefca5b7757bb60804d598bb40fbc0e89dd20b4cc6fa52b470f2e3"},{"path":"formal/chemgraph/challenge_v0_5/runtime/.gitignore","sha256":"238ab2d1c2db076eefe72a59971673a75564ea9856237158e88fdaa58192d014"},{"path":"formal/chemgraph/challenge_v0_5/runtime/README.md","sha256":"c69f6c98e7608cab7f570b5a00212e5798d55dce2637f87b5f2d0797e26a9fb3"},{"path":"formal/chemgraph/challenge_v0_5/schemas/closure_manifest.schema.json","sha256":"5342b2a7bc158658a411b4407c1b6395dc49ab9b23e371ec833bb814abb3051d"},{"path":"formal/chemgraph/challenge_v0_5/schemas/domain_tuple.schema.json","sha256":"3bfa89da7bb54bb0ae8e30045eeb546e936ad75a19c3397817f4d7bf677dda2a"},{"path":"formal/chemgraph/challenge_v0_5/schemas/evidence_class.schema.json","sha256":"2e3e73109884ebc1f61b249215eb519037217d8766e2b3b1537dd1fe820c398a"},{"path":"formal/chemgraph/challenge_v0_5/schemas/p0_contract.schema.json","sha256":"c19ff75b4f390f0b99e48d087b91d27384d339945ac33f5e893798dbbc1fbba0"},{"path":"formal/chemgraph/challenge_v0_5/schemas/p1_source_freeze.schema.json","sha256":"0587d18405e433d24dcbf173be2c5aa4ca44dee65d6c05a77f6ada5fba8c9a85"},{"path":"formal/chemgraph/challenge_v0_5/schemas/raster_class.schema.json","sha256":"b153d4f5e794f965f0e30c1ce711733ef2cdac6606a90208283961d6dc323ad1"},{"path":"formal/chemgraph/challenge_v0_5/schemas/raster_pilot_record.schema.json","sha256":"68bd48babf3ea9205ee8eb07a9b0c32e5b6550afd0a4430edb8179a76ec5df00"},{"path":"formal/chemgraph/challenge_v0_5/schemas/raster_pilot_resource.schema.json","sha256":"4ba5295b587e8b6378d341223a54b6d9f661bff7612a49c713bb988799ced470"},{"path":"formal/chemgraph/challenge_v0_5/schemas/raster_pilot_validation.schema.json","sha256":"6031a787923330120995f33deb14f2106b547aff23b4d8ea26cfae0745086bb2"},{"path":"formal/chemgraph/challenge_v0_5/supervise_raster_pilot_v0_5.py","sha256":"0979774e7bf8f2f46793147e0679be6f83a2a39f41f6eba0659b5622b3619a19"},{"path":"formal/chemgraph/challenge_v0_5/test_canonical_raster_v0_5.py","sha256":"d89a42d974bf4d655859fb5784b51b9ddf70b8e8f6df28e187bf727c424269de"},{"path":"formal/chemgraph/challenge_v0_5/test_domain_scene_v0_5.py","sha256":"a4fc64ace71713c325f8a499be052cf8f6f2f6d7d964ebd55d9ebb3e0963af85"},{"path":"formal/chemgraph/challenge_v0_5/test_enumerate_domain_reference_v0_5.py","sha256":"6bcd73f6ac74fe80e4810aaadb3e7d57658480c2d4822ad61e7545bb69012160"},{"path":"formal/chemgraph/challenge_v0_5/test_enumerate_domain_v0_5.py","sha256":"1de38162f1fe97d0a93e16dc0ab81b95dd96983a93b40e5557987f5178c22f8f"},{"path":"formal/chemgraph/challenge_v0_5/test_run_raster_pilot_v0_5.py","sha256":"c110f264475b9153fc7d7760be941bf6add03fad1a3ec0a801ce42bf5e4ecbac"},{"path":"formal/chemgraph/challenge_v0_5/test_supervise_raster_pilot_v0_5.py","sha256":"8d196f86b60d12dbf04ddb6e076367fc203f3c657f869bc8d2cd476af3d59083"},{"path":"formal/chemgraph/lake-manifest.json","sha256":"dcbedbe248dacd0149105b9fbd8708f42e10a2263af17e4630d1a9a282907602"},{"path":"formal/chemgraph/lakefile.toml","sha256":"417b1250452338fa7a19ee329c1d9a66a3735104f06e2247c7d05b4ee35ceb03"},{"path":"formal/chemgraph/lean-toolchain","sha256":"302cd63c54178885b89e669f33b38f12f4dd7ae7e5cac537b3203e3768d8fb2b"}],"external_dependencies":[{"path":"/usr/bin/apptainer","role":"apptainer","sha256":"1d2fcc7e78ea4a6e5d5b9732520022413aa697ce4d2c18754ff30826384dbc9b"},{"path":"/usr/bin/mount","role":"mount","sha256":"bad230d68e012eb1a2fcaa3b42688d912940f5c61f041ae9451eee7dfb858ff1"},{"path":"/opt/chemgraph/runtime/f6c91d4743df17faa4c50a66f6cd9ae00cb5c9e9d265edfcab7759016b79dc60.sif","role":"runtime_sif","sha256":"f6c91d4743df17faa4c50a66f6cd9ae00cb5c9e9d265edfcab7759016b79dc60"},{"path":"/usr/bin/umount","role":"umount","sha256":"80e84907e5cb4248255c3985e2f7ed55d14fbd45d344a599fdb5cac314b9473c"}],"p0_contract_sha256":"55ddcaacdf851166554ccd586b2a924c0e793f86cc7a6319f98132ef0ffb6b65","p1_source_commit":"fa796de982e9de63d4cff3015fbfa45317365e38","schema_version":"chemgraph-observation-closure-p1-source-freeze-v0.5","status":"p1_source_frozen","training_authorized":false}
